{
  "schema_version": "1.0.0",
  "defect_id": "00_01-D01",
  "game_id": "00_01",
  "title": "\u4fee\u7406\u7387\u304c\u5897\u3048\u3066\u3082\u898b\u305f\u76ee\u304c\u5909\u308f\u3089\u306a\u3044",
  "lifecycle": "implemented",
  "target_learners": {
    "grades": ["\u5c0f4", "\u5c0f5", "\u5c0f6"],
    "support": "facilitated",
    "estimated_minutes": 35
  },
  "learning": {
    "primary_concept": {"id": "feedback-sync", "label": "\u8868\u793a\u306e\u540c\u671f"},
    "secondary_concepts": [
      {"id": "state-management", "label": "\u72b6\u614b\u7ba1\u7406"},
      {"id": "message-passing", "label": "\u30e1\u30c3\u30bb\u30fc\u30b8\u30d1\u30c3\u30b7\u30f3\u30b0"}
    ],
    "objective": "\u6570\u5024\u3068\u30b3\u30b9\u30c1\u30e5\u30fc\u30e0\u306e\u4e0d\u4e00\u81f4\u3092\u518d\u73fe\u3057\uff0c\u72b6\u614b\u66f4\u65b0\u5f8c\u306e\u901a\u77e5\u304c\u8868\u793a\u306b\u5fc5\u8981\u306a\u7406\u7531\u3092\u8aac\u660e\u3059\u308b\uff0e"
  },
  "versions": {
    "complete": {
      "version": "1.0.0",
      "source_path": "games/robot-repair-clicker",
      "behavior": "repair_percent\u3092\u66f4\u65b0\u3057\u305f\u5f8c\u306brobot_progress_update\u3092\u9001\u4fe1\u3057\uff0c25%\u3054\u3068\u306b\u30b3\u30b9\u30c1\u30e5\u30fc\u30e0\u3092\u66f4\u65b0\u3059\u308b\uff0e"
    },
    "defective": {
      "version_label": "defect-stale-robot-costume",
      "delivery": "patch",
      "base_version": "1.0.0",
      "patch_targets": ["games/robot-repair-clicker/stage.gs"]
    }
  },
  "fault": {
    "category": "feedback-sync",
    "symptom": "\u4fee\u7406\u56de\u6570\u3068\u4fee\u7406\u7387\u306f\u5897\u3048\u308b\u304c\uff0c\u30ed\u30dc\u30c3\u30c8\u306f\u6700\u521d\u306e\u58ca\u308c\u305f\u898b\u305f\u76ee\u306e\u307e\u307e\u306b\u306a\u308b\uff0e",
    "expected_behavior": "\u4fee\u7406\u7387\u304c25%\uff0c50%\uff0c75%\uff0c100%\u306e\u5883\u754c\u306b\u9054\u3059\u308b\u305f\u3073\u306b\u898b\u305f\u76ee\u304c\u6bb5\u968e\u7684\u306b\u5909\u308f\u308b\uff0e",
    "root_cause": "add_repair_progress\u304b\u3089robot_progress_update\u306e\u9001\u4fe1\u304c\u629c\u3051\uff0cmain\u30b9\u30d7\u30e9\u30a4\u30c8\u306eupdate_robot_costume\u304c\u9014\u4e2d\u7d4c\u904e\u3067\u547c\u3070\u308c\u306a\u3044\uff0e",
    "trigger": "repair_percent\u304c24%\u4ee5\u4e0b\u304b\u308925%\u4ee5\u4e0a\u306b\u306a\u308b\u30af\u30ea\u30c3\u30af\u3092\u884c\u3046\uff0e"
  },
  "reproduction": {
    "preconditions": [
      "max_repair\u306f30\uff0crepair_per_click\u306f1\u306e\u521d\u671f\u8a2d\u5b9a\u306b\u3059\u308b\uff0e",
      "\u7dd1\u306e\u65d7\u304b\u3089\u30b2\u30fc\u30e0\u3092\u958b\u59cb\u3057\uff0cplaying\u306b\u306a\u308b\u307e\u3067\u5f85\u3064\uff0e"
    ],
    "steps": [
      {"step": 1, "action": "\u30ed\u30dc\u30c3\u30c8\u30927\u56de\u30af\u30ea\u30c3\u30af\u3059\u308b\uff0e", "expected_observation": "\u4fee\u7406\u7387\u306f23%\u3067\uff0crobot_0\u306e\u898b\u305f\u76ee\u3067\u3042\u308b\uff0e"},
      {"step": 2, "action": "\u3082\u30461\u56de\u30af\u30ea\u30c3\u30af\u3059\u308b\uff0e", "expected_observation": "\u4fee\u7406\u7387\u306f26%\u3060\u304c\uff0crobot_25\u306b\u5909\u308f\u3089\u305arobot_0\u306e\u307e\u307e\u3067\u3042\u308b\uff0e"},
      {"step": 3, "action": "\u6570\u56de\u8ffd\u52a0\u3067\u30af\u30ea\u30c3\u30af\u3059\u308b\uff0e", "expected_observation": "\u6570\u5024\u3060\u3051\u304c\u5897\u3048\uff0c\u898b\u305f\u76ee\u304c\u66f4\u65b0\u3055\u308c\u306a\u3044\uff0e"}
    ]
  },
  "repair": {
    "minimal_fix": {
      "description": "add_repair_progress\u3067\u4fee\u7406\u7387\u3068UI\u3092\u66f4\u65b0\u3057\u305f\u5f8c\u306brobot_progress_update\u3092\u9001\u4fe1\u3059\u308b\uff0e",
      "edit_targets": [
        {"path": "games/robot-repair-clicker/stage.gs", "anchor": "broadcast \"robot_progress_update\";"}
      ],
      "constraints": [
        "repair_percent\u306e\u8a08\u7b97\u5f8c\u306b\u8868\u793a\u3092\u66f4\u65b0\u3059\u308b\uff0e",
        "1\u30af\u30ea\u30c3\u30af\u306b\u3064\u304d\u898b\u305f\u76ee\u306e\u66f4\u65b0\u30921\u56de\u3060\u3051\u901a\u77e5\u3059\u308b\uff0e",
        "\u4fee\u7406\u7387\u3068\u30af\u30ea\u30a2\u5224\u5b9a\u306e\u8a08\u7b97\u306f\u5909\u66f4\u3057\u306a\u3044\uff0e"
      ]
    },
    "acceptable_alternatives": [
      {
        "description": "repair_clicked\u306e\u53d7\u4fe1\u5f8c\u306b\uff0c\u66f4\u65b0\u6e08\u307f\u306erepair_percent\u3092\u7528\u3044\u3066\u30b3\u30b9\u30c1\u30e5\u30fc\u30e0\u66f4\u65b0\u7528\u30e1\u30c3\u30bb\u30fc\u30b8\u30921\u56de\u9001\u308b\uff0e",
        "acceptance_criteria": [
          "25%\uff0c50%\uff0c75%\uff0c100%\u306e\u5883\u754c\u3054\u3068\u306b\u6b63\u3057\u3044\u898b\u305f\u76ee\u306b\u306a\u308b\uff0e",
          "\u6570\u5024\u3068\u898b\u305f\u76ee\u304c\u540c\u3058\u30af\u30ea\u30c3\u30af\u306e\u7d50\u679c\u3068\u3057\u3066\u4e00\u81f4\u3059\u308b\uff0e",
          "\u30af\u30ea\u30a2\u3068\u30b2\u30fc\u30e0\u30aa\u30fc\u30d0\u30fc\u306e\u72b6\u614b\u9077\u79fb\u3092\u58ca\u3055\u306a\u3044\uff0e"
        ]
      }
    ],
    "rejected_shortcuts": [
      "robot_0.svg\u3092\u5b8c\u6210\u6e08\u307f\u306e\u898b\u305f\u76ee\u306b\u5dee\u3057\u66ff\u3048\u308b\uff0e",
      "\u6570\u5024UI\u3092\u96a0\u3057\u3066\u4e0d\u4e00\u81f4\u3092\u898b\u3048\u306a\u304f\u3059\u308b\uff0e",
      "max_repair\u30921\u306b\u3057\u3066\u9014\u4e2d\u8868\u793a\u3092\u767a\u751f\u3057\u306a\u304f\u3059\u308b\uff0e"
    ]
  },
  "tests": [
    {
      "test_id": "00_01-D01-T01",
      "kind": "symptom",
      "setup": "max_repair\u309230\uff0crepair_per_click\u30921\u306b\u3059\u308b\uff0e",
      "actions": ["\u30ed\u30dc\u30c3\u30c8\u30928\u56de\u30af\u30ea\u30c3\u30af\u3059\u308b\uff0e"],
      "expected_complete": "repair_percent\u306f26\uff0c\u30b3\u30b9\u30c1\u30e5\u30fc\u30e0\u306frobot_25\u306b\u306a\u308b\uff0e",
      "expected_defective": "repair_percent\u306f26\u3060\u304c\uff0c\u30b3\u30b9\u30c1\u30e5\u30fc\u30e0\u306frobot_0\u306e\u307e\u307e\u306b\u306a\u308b\uff0e",
      "automatable": true
    },
    {
      "test_id": "00_01-D01-T02",
      "kind": "regression",
      "setup": "max_repair\u309230\uff0crepair_per_click\u30921\u306b\u3059\u308b\uff0e",
      "actions": ["\u30ed\u30dc\u30c3\u30c8\u309230\u56de\u30af\u30ea\u30c3\u30af\u3059\u308b\uff0e"],
      "expected_complete": "repair_percent\u306f100\uff0c\u30b3\u30b9\u30c1\u30e5\u30fc\u30e0\u306frobot_100\uff0cgame_state\u306fclear\u306b\u306a\u308b\uff0e",
      "expected_defective": "repair_percent\u306f100\uff0c\u30b3\u30b9\u30c1\u30e5\u30fc\u30e0\u306frobot_100\uff0cgame_state\u306fclear\u306b\u306a\u308b\uff0e",
      "automatable": true
    }
  ],
  "hints": [
    {"level": 1, "focus": "observation", "prompt": "\u6570\u5024\u3068\u30ed\u30dc\u30c3\u30c8\u306e\u898b\u305f\u76ee\u306f\uff0c\u3069\u306e\u77ac\u9593\u304b\u3089\u5408\u308f\u306a\u304f\u306a\u308a\u307e\u3059\u304b\uff0e"},
    {"level": 2, "focus": "reproduction", "prompt": "\u4fee\u7406\u738723%\u306e\u3068\u304d\u304b\u3089\uff0c\u6b21\u306e1\u56de\u3060\u3051\u3092\u3088\u304f\u89b3\u5bdf\u3057\u307e\u3057\u3087\u3046\uff0e"},
    {"level": 3, "focus": "variable", "prompt": "repair_done\uff0crepair_percent\uff0crobot_stage\u306e\u3046\u3061\uff0c\u6b63\u3057\u304f\u5909\u308f\u3063\u3066\u3044\u306a\u3044\u306e\u306f\u3069\u308c\u3067\u3059\u304b\uff0e"},
    {"level": 4, "focus": "control-flow", "prompt": "update_robot_costume\u306f\u3069\u306e\u30e1\u30c3\u30bb\u30fc\u30b8\u3092\u53d7\u3051\u53d6\u3063\u305f\u3068\u304d\u306b\u547c\u3070\u308c\u307e\u3059\u304b\uff0e"}
  ]
}
